,Класс,Текст
0,1,я хотела бы поделиться своим отзывом о тональном креме пользуюсь этим кремом уже несколько недель и могу сказать что он превзошел все мои ожидания текстура крема очень приятная он легко наносится на кожу и не оставляет никаких следов или ощущения липкости крем хорошо распределяется и мгновенно впитывается тональный крем обладает отличными увлажняющими свойствами моя кожа стала значительно мягче и гладкой после использования крема также стоит отметить что у крема есть свой запах но он быстро улетучивается и не остаётся на коже в общем у меня положительное впечатление от тонального крема он отлично увлажняет и освежает кожу помогает бороться с признаками старения и создает естественное покрытие в целом неплохой тональный крем особенно если вам важна увлажнённость и матовое покрытие
1,1,давно искала идеальный тональный крем фирму выбрала не случайно потому что люблю оригинальную качественную корейскую продукцию крем заказывала на ссылка пришёл быстро действительно скрывает все несовершенства в подарок положили пробник крем для лица тональный крем и пробниктак как у меня жирная кожа лица то после нанесения крема есть небольшой жирный блеск нужно сверху использовать пудру фото дофото сделано без фильтров и результат мне действительно понравился это лучший тональный крем который я использовала фото после
4,1,о данном тональном креме я узнала пару месяцев назад от блогера в ютуб и многие его хвалили вдобавок обогащен интересными ингредиентами да еще и низкая цена любопытство взяло надо мной верх приобрела в шикарно оформленный флакон из матового стекла с толстыми стенками и дном надписи черной краской золотистые линии набиты очень качественно на лицевой стороне информация об особенностях крема отсутствие масел в составе наличие гиалуроновой кислоты термальной воды в составе и защита микробиома кожи финиш указан сатиновым также здесь производитель обещает эффект второй кожи сзади указана степень покрытия из номер и название оттенка у меня расписаны те же свойства что и на лицевой стороне также информация о стойкости тона часов информация на русском языке объем мл срок годности после открытия тона в рамках срока годности месяцев общий срок годности года как и подобает тональным кремам дата производства также указана мне попался совсем свеженький крем крышка закрывается легко с характерным щелчком а вот открывается уже чуть сложнее надо приложить небольшие усилия на поверхности тон стоит стойко пониз флакона имеются небольшие ножки упаковка продумана до мелочей выглядит как у люкса помпа работает отлично выдает тон дозировано горлышко совсем узенькое мне нравится состав полон полезных ингредиентов которые расположены в начале и середине это большой плюс свойства применение тон имеет выраженный запах такой бывал у шампуней от чистая линия воспоминания из далеких довольная густая однородная но я по привычке все равно взбалтываю флакон перед нанесением тона цвет скорее следовало назвать он теплый распределила тон обволакивает кожу восхитительно действительно эффект второй кожи как и обещано производителем фото в разном освещении тон можно наносить как толстым слоем так и тонким способен перекрыть на родинки он имеет свойство уходить в розовинку и чуть темнеть после минуты распределения посмотрите на свеженанесенный свотч на уже распределенный тон проверяю стойкость водой даже мыла небольшое количество посуды с этим свотчем на руке на тон воду выдержал демакияж осуществила влажной салфеткой но лучше пользоваться мицеллярной водой чтоб наверняка точно очистить поры от тона у меня нормальная кожа оливковый теплый подтон загорелая нанесла сначала солнцезащитный крем затем поверх данный тон спонжем таким образом получается легкое покрытие если хотите плотное то лучше выбрать тон или основу под макияж очень легкую без масел и тон наносить пальцами тон лег идеально не подчеркнул поры не провалился в них ощущается легко на коже как увлажняющий крем он прекрасно подойдет как молодой так и возрастной рекомендую наносить его под глаза отдушка в составе жжет их по крайней мере так было у тон прекрасно легла фиксирующая пудра тон в конце дня после ополаскивания лица водой сошел локально если хотите высокой стойкости то не наносите крем под тон другой раз когда не ополаскивала лицо тоже под конец дня это отличный результат тон если и сходит локально то на общем фоне это абсолютно непримечательно итог тональная основа отлично увлажняет кожу подстраивается под нее аккуратно обволакивает поры не подчеркивая их имеет среднюю стойкость и среднюю плотность которую можно варьировать аллергии прыщей подкожников не бы назвала данный тон легкой версией известного тона может слегка опечатываться в отличие от него но при этом какова разница в цене в пользу нашей гостьи этого отзыва однозначно рекомендую представлен во многих известных
5,1,всем привет до этого тонального крема с брендом я была знакома только с отзывов блогеров знаю что в бренде есть много хороших качественных средств по относительно недорогой цене ну и на смену любимчику я решила купить все таки положительные отзывы и рекомендации сделали свое рублей со скидкойобъем хочется отметить что у тона шикарная упаковка тяжелая стеклянная и видно что производитель отчасти над этим заморочился мне очень нравится дизайн выглядит как люкс конечно сравнивать с люксом глупо но это только про дизайн с обратной стороны есть наклейка с информацией о средстве помпа у тона отсутствует зато есть аппликатор внушительных размеров вполне удобен и даже негигиеничность в использовании меня не смущают по идее в косметичке у нас есть предостаточно средств с такими аппликаторами тем более тональный крем использую только ограничитель хороший текстура и средней плотности чуть суховатая наношу его в основном влажным спонжем так он становится более пластичным кистью тоже наносится хорошо но у спонжа более тонкое покрытие при нанесении не залипает и не полосит сухость не подчеркивает у меня оттенок по идее светлый и нейтральный но на самом деле имеет слегка розовый подтон поэтому я частенько мешаю его с аджастером от мэнли единственный небольшой минус тона в том что у нас представлено совсем немного оттенков трудно выбрать нужный небольшое сравнение с моими тональными основами в у меня жирная и временами бывают воспаления и соответственно от тонального крема я обычно жду стойкость и выравнивание тона не люблю плотные и матирующие тональные основы и сейчас стараюсь выбирать более легкие варианты тем более при надобности я могу перекрыть недостатки корректором или нанесла тон влажным спонжем без консилера и корректора кроющая способность хорошая сильные я корректирую дополнительно финиш натуральный слегка сияющий тон очень хорошо наслаивается и как будто сцепляется с кожей на лице он практически не заметен при фиксации почти не после в полном макияже выглядит отлично но даже с матирующей пудрой финиш ближе к натуральному макияже у меня обычно проблемные зоны это крылья носа иногда тональный крем там слегка забивается и выглядит так себе особенно с матирующими тональными кремами с все выглядит более менее хорошо к концу дня макияж выглядит адекватно в целом блеск начинает проступать спустя часового рабочего дня выглядит вот так кремом я осталась довольная наносится максимально легко и быстро вообще беспроблемно раньше моим любимчиком был но прямо потеснил его однозначно повторю
6,1,ни для кого не секрет что комби кожа и жирная это одни из сложнейших типов кожи в плане подбора средств нужно выбирать такие которые не только дают видимый результат но и работают на а именно в нашем случае не забивают поры то есть не девочкам с явными высыпаниями особенно в стадии обострения вообще очень часто бывает сложно скрыть акне и у меня есть супер рекомендация и сейчас я расскажу подробнее о тональном который вам точно должен понравится тональный крем крем тональный крем бельгия тональный крем жирная годности после ориентировочно можно помониторить промокоды на скидку последний раз я взяла по очень выгодной можно купить во всех крупных магазинах косметики тональный крем линейке представлена просто уйма оттенков и если честно для меня это больше усложняет выбор чем помогает наверное для визажистов это будет преимуществом но для простого люда думаю магическим образом очень удачно подобрала себе оттенок с первого раза тональный крем меня в оттенке дальше посмотрим его на свотчах тональный крем картонной упаковки находится гость программы тональный крем в стеклянном флаконе тональный крем тональный крем красивый и лаконичный нанесенная на этикетке информация но не на нашем языке тональный крем же на дне флакона дублируется оттенок тональный крем помповый и очень удобный тональный крем дозирует средство силой нажатия и если надо жмем нежнее тональный крем текстуре приятный средний по густоте хорошо распределяется и у него есть явное преимущество о котором я рассказала в видео можно посмотреть тональный крем тональный крем тональный крем очевидно что плотность покрытия у тонального крема начинается с среднего и может быть достаточно высокой однако за счет того что тон имеет некое жидкое состояние я часто использую его тоненьким слоем тональный крем матовый но на коже он не выглядит наглухо инфу разобрали перейдем к использованию тональный крем о моей коже комбинированного и частые воспалительные элементы на в результате лечения акне с расширенными порами сразу скажу что этот тональный крем я повторила вот на днях заказала в рив гош с промокодом который действовал на клиник и тон мне обошелся в мне необходимо идти на мероприятие работу или есть необходимость быть уверенной в стойкости и качестве макияжа на я выбираю бы перед использованием качественно подготавливать кожу в зависимости от вашего мое в макияже это выглядит тональный крем тональный крем нравится что тон не блокирует матирует наглухо кожу присутствует некий который дает ощущение что кожа ухоженная холенная живая часов запросто дольше не носила не что не подчеркивает шелушинки неровности не проваливается в поры даже на фото вверху я намерено сфотографировала часть своей проблемной зоны с расширенными порами так близко тон ложится хорошо и смотрится все течении дня тон никуда не съезжает тональный крем если есть необходимость в матирование кожи можно добавить пудру дополнительно я крайне негативно отношусь к такому эффекту на своей хоть и матирует но при этом не сушит так как в состав входит гиалуроновая заявлено что тон не только маскирует но и корректирует некоторые проблемы кожи а сокращает пигментные пятна выравнивает осветляет тон и увлажняет кожу с помощью трех высокотехнологичных сывороток всего через недель применения цвет лица становится более ровным кожа разглаживается и наполняется сиянием а ощущение увлажнения сохраняется даже после удаления макияжа еще варианты макияжа с эти тональный крем тональный крем дружит со всеми моими косметическими штучками и не окисляется ни от одного средства тональный крем тональный крем нравится что кожа остается будто подсвечена изнутри тональный крем на мой взгляд шикарен я сравнивала его с эсти лаудер клиник понравился гораздо себя я отметила следующие и уверенность в макияже в любых спф пусть небольшого но все компоненты в результат на проблемной маскирует без эффекта после себя подсвеченную кожу варьировать степень больше полезных средств по уходу за кожей волосами а так же обзоры на декоративную смотрите на моей страничке твой добрый друг и помощник в выборе средств
7,1,доброго времени суток я думаю любой девушке достаточно сложно подобрать тональное средство для своей коже даже когда выбираешь в магазине толи там освещение не такое но после покупки и первого использования замечаешь как тоналка просто выделяется на коже не подходит цвет выделяются шероховатости не вот я искала очень долго подходящую тональную основу какие только я не покупала и из дорогого сегмента и из дешевого и и сс и кушон деньги в мусор толку я собственно методом перебора и наткнулась на средство от в увлажнение и тон просто взяла попробовать выбрала я оттенок естественный он мне подошел конечно были сомнения что ошибусь с оттенком но все хорошо серия предназначена для нормальной и сухой кожи у меня сухая жирная что порадовало так это наличие защиты от не нужно дополнительно наносить защиту упаковка пластиковая красивого розового оттенка на ощупь туба приятная объем мл с откручивающейся крышкой содержимое цвета приятная кремовая текстура не растекается запах легкий не навязчивый и очень приятный нанесение на подготовленную заранее очищенную и уже увлажненную кожу распределяю небольшое количество распределяется равномерно я люблю наносить просто руками после нанесения быстро впитывается и не оставляет жирных следов результат идеальный ровный тон отлично увлажняет делает легкое ровное покрытие сверху наношу только консилер и пудру и то по необходимости не всегда не выделяет шелушение делает кожу на щеках однотонной я очень довольна тональным средством да еще он из бюджетной линейки это не может не радовать
