,Класс,Текст
37,1,доброго времени суток дорогие милые читатели мой сегодняшний отзыв станет полезным ведь я расскажу про очень хорошее косметическое информация натуральный тональный крембренд изготовитель ооо грининдастри г москваэто наш российский данным брендом я познакомилась относительно не давно год с небольшим но влюбилась в него покупки заказала крем на вайлдбериз также его можно купить и на других маркетплейсах в магазинах я ни разу этот бренд не крема рублей на момент покупки сейчас смотрю он уже чуть дешевле стоит это вайлдбериз надо мониторить цены разные каждый кремушек пришёл вот в такой простенький я пишу в простенькой аналогичный крем этой фирмы пришёл вообще в космически шикарной упаковке я аж удивилась можете посмотреть и почитать тут хотя в целом мне фиолетово на упаковку главное чтобы сам крем был рабочим и с хорошим составом дизайн коробочки симпатичный дорого если бы я не знала нет цену я бы подумала что это супер премиум крем маркетологи у фирмы однозначно молодцы всё так стильно и современно сделали сбоку коробочки можно прочитать много полезной информации про крем способ применения и другие нюансы с другого бока подробно и четко прописан полный состав я тоже очень сильно хвалю производителя ведь он в отличии от многих других отечественных производителей прописал состав на русском языке а бонусом и на английском супер тюбик крема а так лаконично выглядит современный дизайн флакона на обратной стороне вела продублировансоставспособ примененияизготовительк упаковке претензий нет теперь поговорим непосредственно про сам крем использования минимум год думаю даже крем я заказываю уже не впервые раз вот например мой старый и новый тюбик старый закончился и на смену я заказала новый такой крема как видите консистенция точно такая же как и у любого другого но уже не натурального тонального крема консистенция отличная она не слишком жидкая и не с перебором густая всё так как должно я практически ничего не чувствую мне кажется что нет отдушки а вот другой крем этого производителя ссылку я давала выше он пахнет сладкой думала этот будет также ощущаться но совсем это тоже не кожа лица она не идеальная но и не совсем плохая среднячок были акне осталось не много следов не щеках летом на носу вылезает веснушек зимой их выглядит крем на лице фильтров и редактирования фото не было учитывайте ещё тот факт что камера и освещение ухудшают в реальности кожа крем обеспечивает максимальную незаметность на коже при невысокой кроющей способности поэтому на явные дефекты необходимо предварительно точечно нанести даёт крем он не замаскирует проблемы кожи так как например это сделает крем был у меня такой вот он конечно мощную маску создавал и замывал все тот крем ужасно забивает поры состав там не очень я решила не добивать свою кожу и перешла на натуральную слегка освежит цвет лица увлажнит кожу и сделает её более красивой и этом всё не стоит ждать чуда от этой тоналки это типа крема даже началу я не была довольна эти кремом привыкла к тоналкам которые замазывают все проблемы этот крем сопротивлялась искала другие крема но когда начинала измучать состав понимала там жесть и снова возвращалась к полюбила свою кожу со всеми изъянами я делала лазерную шлифовку лица ерунда это все к годам я поняла что глупо маскировать каждую свою веснушку мощной тоналкой короче я выбрала натуральный тональный крем и естественный к теперь этот крем любовь на века состав очищенная масло рисовых отрубей натуральный эмульгатор из глюкозы и раст масел тего каре диоксид титана масло конопли холодного отжима витамин витамин натрия фитокератин пребиотик экстракты готу колы и бамбука глицин цетеариловый спирт молочная кислота натур витамин провитамин витамин с органический консервант шаромикс эфирные масла бархатцев нероли жасмина герани натуральные пигменты желтый красный и черный оксиды железа я попробовала его изучить через сайт экоголик и вот такой вышел результат сайт считал не все ингредиенты а те что он считал я оцениларисгераньжасминвитамин горькийаскорбиновая кислотамолочная кислотадумаю это всё максимально полезно для кожи есть вещества которые титана его часто добавляют в таблетки и это вредно для кишечника он не выводится из вот диоксид титана в кремах диоксид титана обладает способностью отражать и рассеивать ультрафиолетовое излучение что помогает защитить кожу от вредного воздействия солнца поэтому его часто можно встретить в рецептуре солнцезащитных кремов тональных средств или солнцезащитных я понимаю диоксид титана работает в составе как есть ли вред диоксид титана в общей классификации опасных веществ входит в четвертый класс то есть мало опасен и нетоксичен для кожи он вовсе не представляет никакой опасности самый важный момент его концентрация в косметических средствах в тональных кремах она не должна превышать в пудрах я спокойна для кожи он не опасен и я уверена что фирма не перебарщивает с его количеством в составе следующий нюанс который меня смутилпигменты желтый красный и черный оксиды железа что это и как оно влияет на кожу неорганические или минеральные пигменты которые широко встречаются в природе в виде минералов гематита и магнетита оксиды железа обладают большим разнообразием цветов от до чёрного по сравнению с органическими синтетическими красящими веществами оксид железа безопасен стабилен и не вызывает аллергические что эти оксиды тоже абсолютно могу сказать составом я довольна самом кремом крема его можно не смывать на ночь так как он безопасный я всё равно его смываю крем умывашкой от фирмы пока не успела о ней написать одно примулам во крема его на лице не видно он не создает эффект маски минус крема особых минусов у крема я не нашла но коже он так нравится что она словно сьедает его поэтому я дважды в день его наношу на этот крем можно использовать как основу под макияж если вы всё хотите тоналку по мощнее можно взять как основу ваша кожа только спасибо за это скажет на этот крем кожа отлично реагирует для какой кожи подходит крем для сухой и нормальной так написано на упаковке хотя я бы сказала что подходит для любой ли я тональный крем от да да да это моя любовная любовь вот уже год я пою ему дифирамбы моя оценка звёзд всем огромное спасибо за внимание
39,1,здравствуйте честно признаюсь что этот тональный крем рассматривала как вариант объем флакона всего да и с собой в косметичке брать удобно сам флакон не тяжелый хоть и стеклянный но небольшой формат с дозатором всегда лучше и удобнее дозатор вещь удобная но в этом случае все же местами вредная потому что дозатор немного порой заедает и едет туговато да и средство дозируется порой так напористо как струя поэтому при первом применении я слегка промахнулась мимо руки а это сразу увеличивает расход тонального к дозатору нужно приспосабливаться и контролировать сиду нажатия потому что пробка не пружинит как это обычно бывает приспособиться все же получилось но без накладок не обходится поэтому для частых покупок не рассматриваю по текстуре тональный крем между легким и немного плотноватым покрытием маскирует он неплохо но сильную красноту на лице видно зато для фото очень даже хорошо подходит потому что тональное средство с сияющими частичками выравнивает тон лица поэтому на фото выглядит все красиво и естественно наносить крем было не так просто кистью потому что ожидаемого легкого скольжения с тонкой вуалью на коже не получалось поэтому до тонкого красивого покрытия я довожу спонжем похлопывающими движениями все же крем немного туговато распределяется даже кистью но зато однородно в целом без пятен после нанесения крем практически сливается с кожей не создавая эффекта маски в целом ощущения комфортные и приятные кожа нежная увлажненная и мягкая прикасаться приятно интересный факт что даже в жару лицо с этим тональным средством не походит на жирный блин но для жирной проблемной кожи все же подойдет только на более прохладную погоду только меня смущают настолько крупные светоотражающие частицы в тональном средстве но на лице я их не получается ровный более естественное покрытие с легким сиянием в течение дня тональный крем не окисляется не заваливается в поры и не расползается в пятнистый узор даже жару выдержал достойно после неоднократного тестирования тонального средства в разную погоду могу смело его рекомендовать потому что плюсов все же больше да и в итоге минусом является дозатор который туговат и нужно подстраиваться тональное средство на мой придирчивый взгляд достаточно достойное надеюсь мой отзыв был полезен для вас в моих отзывах вы найдете много интересного и полезного благодарю вас за уделенное время отличного вам настроения
40,1,приобрела это тонально средство для лета решила что мой самый лучший и любимый эрбориан жирноват глупости состав на самой тубе не представлен он был на коробочке которую я выбросила срок с момента вскрытия месяцев но учитывая наличие хорошего дозатора который не позволяет кислороду попадать внутрь думаю пользоваться можно и больше цвет светлый их всего внешний вид тонального средства внешний между вы не поверите сислей и ля рош решила что между и разница существенная но только не в итоговом виде на коже она почти идентичны но на мой взгляд сислей больше проваливается в поры шокля рош действительно хорош легкий выравнивает тон и скрывает мелкие несовершенства наношу самой любимой кистью от кле де по момент растушевки тонального средствачто могу сказать спустя несколько недель у меня появилось несколько высыпаний не могу точно связать с тональным средством возможно сбой организма и просто совпало по времени наносится очень легко не окисляется в течение дня не становится рыжим по границам нанесения на зону под глазами наносить не стоит в этой зоне может немного подчеркнуть морщинки лежит ровно без пятен кожа выглядит здоровой маски нет финиш сатиновый местами блеска даже много у меня комбинированная кожа приходится припудривать или обязательно наносить матируюшую руке блеск не виден но покажу вам вполне хороший исход думаю так будет выглядеть крем на сухой коже учитывая что кожа рук у меня именно такая полное слияние стоит учесть что кожа рук намного темнее лица поэтому не смотрите на выбеливание итог как выглядит тональное средство после растушевки итог как выглядит тональное средство после растушевкиснимаю одну звезду за то что не так идеален как эрбориан на комбинированной коже
41,1,всем привет хочу рассказать вам о тональном от я тональными кремами пользуюсь крайне редко потому что не люблю ощущение косметики на моем лице но этот продукт должен быть в косметичке может предстоит пойти на мероприятие или встречу или замаскировать неприятности на лице данный тональный помещен в стеклянный флакон объемом он прочный при падении не разбивается чему я была крайне рада пипетка самая обычная удобная у меня тон бы я купила это тональный в начале лета то могла бы и не переживать за уф защиту ведь данный тональный имеет супер много конечно но для такого продукта очень даже неплохо средство не жидкое даже достаточно густое распределяется хорошо я люблю делать это спонжем для макияжа так тон получается ровным перекрытие хорошее на первый взгляд тон немного желтит но он хорошо подстраивается под тон кожи а особенно если в сочетании с другими продуктами кожа выглядит отлично шелушения не подчеркивает что очень важно и не забывайте перед применением наносить праймер или мере дневной крем для бы сказала что тональник не очень стойкий через часа уже проступает блеск и тон начинает немного мигрировать но это вполне естественно я так долго и не ношу тон но я вполне довольна продуктом за свои деньги он хорошо себя показал не на но тем не менее покраснения маскирует да и перекрытие мало какие тональники могут дать ну и не нужно забывать что это если коротко то продуктом я осталась довольна а вам его могу смело рекомендовать
42,1,всем привет у меня кожа не ровная то веснушки то пигментные пятна то еще высыпало зацвело тональными средствами пользуюсь круглый год поэтому у меня этих тональников склад есть еще не показанныйтональный крем с обратной стороны есть информация написано что крем средней плотности покрытия уже покупая я примерно представляла чего у крема тоненький легко дозировать хоть по капельке если не хватило то можно подкорректировать экономно меня тон есть распределяется по коже на коже не ощущаетсяне стойкости слабоват примерно часа начинает исчезать с кожикрем стоит рублей поэтому я и не думала что он будет течении дня подправляю меня остался футляр от кушона для лица в помыла и вот я подлила кремушка туда и спонжиком подправляю хожу теперь крем всегда со мной и удобно и экономично а вот мои отзывы на другие тональные средства тональный крем жидкийтональный с гиалуроновой кислотой крем кушон для лица с увлажняющим эффектомкушон тональный крем часа матовое покрытие крем
43,1,всем привет я жертва рекламы и отзывов на самом деле много читала отзывов на этот тональный крем и мне не приходило в голову купить тут у меня все тональные средства подошли к концу и нужно было выбрать подумала а почему бы и да заказала на вб еще со скидкой вышел рублей не плохо так тональный крем жидкий стильный стеклянный пузырек с пипеткой на обратной стороне есть информация объем крема заказала желтого под тона но и розового тоже нет крем очень спешить при нанесении что бы тон распределился должна быть перед применением подготовлена увлажнена и нанесен праймер тогда крем ляжет ровно и не подчеркнет несовершенства чешуйки сухость примерно процентов пахнет он кстати стойкости тоже не плох часа могу ходить и не поправлять пудрой окисляется оттенка не меняет
